{
  "schema_version": 1,
  "identity": {
    "ranked_identity_id": "018f2c60-0000-7000-8000-000000000201",
    "account_id": "018f2c60-0000-7000-8000-000000000001",
    "erasure_domain_id": "018f2c60-0000-7000-8000-0000000002ff",
    "state": "restricted",
    "resolution_basis": "investigation-resolved",
    "resolved_at": "2026-07-20T12:00:00Z",
    "revision": 7,
    "created_at": "2026-06-01T08:00:00Z"
  },
  "investigations": [
    {
      "identity_investigation_id": "018f2c60-0000-7000-8000-000000000202",
      "ranked_identity_id": "018f2c60-0000-7000-8000-000000000201",
      "state": "concluded-restricted",
      "trigger": "deterministic-control",
      "opened_at": "2026-07-10T10:00:00Z",
      "response_due_at": "2026-07-17T10:00:00Z",
      "concluded_at": "2026-07-20T12:00:00Z",
      "expires_at": "2026-08-10T10:00:00Z",
      "revision": 5,
      "outcome_reason_code": "ACCOUNT_RANKING_RESTRICTED"
    }
  ],
  "events": [
    {
      "identity_event_id": "018f2c60-0000-7000-8000-000000000203",
      "ranked_identity_id": "018f2c60-0000-7000-8000-000000000201",
      "event_type": "restriction-applied",
      "identity_investigation_id": "018f2c60-0000-7000-8000-000000000202",
      "reason_code": "ACCOUNT_RANKING_RESTRICTED",
      "occurred_at": "2026-07-20T12:00:00Z"
    },
    {
      "identity_event_id": "018f2c60-0000-7000-8000-000000000204",
      "ranked_identity_id": "018f2c60-0000-7000-8000-000000000201",
      "event_type": "identity-created",
      "occurred_at": "2026-06-01T08:00:00Z"
    }
  ]
}
